{
  "name": "Correnteza",
  "lang": "pt",
  "concept": "Água azul deslizando sobre água azul; calma que não é vazia.",
  "mood": [
    "liquid",
    "calm"
  ],
  "energy": 0.3,
  "density": "sparse",
  "surface": {
    "type": "screen",
    "w": 1920,
    "h": 1080,
    "fps": 30
  },
  "time": {
    "bpm": 78,
    "bars": 8
  },
  "audio": {
    "strategy": "subtle"
  },
  "compositions": 3
}
