{
  "name": "TECNOFEUDO SMART SAMPA",
  "lang": "pt",
  "concept": "Vigilância urbana como arquitetura de extração: câmeras, drones e dados de pessoas alimentam uma tecnocracia; o sistema lê a cidade em calor e em pixels.",
  "mood": ["industrial", "glitch", "aggressive"],
  "energy": 0.7,
  "density": "balanced",
  "surface": { "type": "led", "w": 3840, "h": 1920, "fps": 30, "pitchMm": 3.9, "viewingDistanceM": [8, 40] },
  "time": { "bpm": 120, "bars": 4 },
  "audio": { "strategy": "structural" },
  "output": { "mode": "alpha" },
  "palette": { "bg": "#060608", "primary": "#FF2A3D", "secondary": "#8C8C96", "accent": "#F2F2F2" },
  "focalEvent": "Os lasers infravermelhos do poste travam no chão e o contador de câmeras sorteia",
  "banned": ["neon glow", "lens flares", "partículas aleatórias"],
  "compositions": 4
}
